{
  "$schema": "https://json-schema.org/draft/2020-12/schema",
  "$id": "https://example.invalid/commander-deck-ai/schemas/combo.v1.schema.json",
  "title": "Combo Fact v1",
  "type": "object",
  "additionalProperties": false,
  "required": [
    "schema_version",
    "combo_id",
    "required_cards",
    "requirements",
    "results",
    "provenance"
  ],
  "properties": {
    "schema_version": {
      "const": "combo.v1"
    },
    "combo_id": {
      "type": "string",
      "minLength": 1
    },
    "name": {
      "type": [
        "string",
        "null"
      ],
      "minLength": 1
    },
    "required_cards": {
      "type": "array",
      "minItems": 1,
      "items": {
        "type": "string",
        "format": "uuid"
      },
      "uniqueItems": true
    },
    "optional_cards": {
      "type": "array",
      "items": {
        "type": "string",
        "format": "uuid"
      },
      "uniqueItems": true
    },
    "requirements": {
      "type": "array",
      "items": {
        "type": "string",
        "minLength": 1
      },
      "uniqueItems": true
    },
    "results": {
      "type": "array",
      "minItems": 1,
      "items": {
        "type": "string",
        "minLength": 1
      },
      "uniqueItems": true
    },
    "steps": {
      "type": "array",
      "items": {
        "type": "string",
        "minLength": 1
      }
    },
    "provenance": {
      "type": "array",
      "minItems": 1,
      "items": {
        "$ref": "#/$defs/provenance_reference"
      }
    }
  },
  "$defs": {
    "provenance_reference": {
      "type": "object",
      "additionalProperties": false,
      "required": [
        "source_id",
        "source_snapshot_id",
        "source_object_id",
        "raw_sha256"
      ],
      "properties": {
        "source_id": {
          "type": "string",
          "minLength": 1
        },
        "source_snapshot_id": {
          "type": "string",
          "minLength": 1
        },
        "source_object_id": {
          "type": "string",
          "minLength": 1
        },
        "raw_sha256": {
          "type": "string",
          "pattern": "^[a-f0-9]{64}$"
        },
        "retrieved_at": {
          "type": [
            "string",
            "null"
          ],
          "format": "date-time"
        },
        "adapter_version": {
          "type": [
            "string",
            "null"
          ],
          "minLength": 1
        },
        "mapper_version": {
          "type": [
            "string",
            "null"
          ],
          "minLength": 1
        },
        "approval_status": {
          "type": [
            "string",
            "null"
          ],
          "enum": [
            "APPROVED_LOCAL",
            "APPROVED_REDISTRIBUTION",
            null
          ]
        }
      }
    }
  }
}
